{
  "identifiers": {
    "ncbi_acc": "KQ948669.1",
    "mibig_acc": "BGC0002318"
  },
  "compound_name": [
    "canucin A",
    "canucin B"
  ],
  "ripp_class": "Lasso",
  "ref": [
    "doi:10.1021/acschembio.0c00109"
  ],
  "entries": [
    {
      "protein_ids": {
        "genpept": "WP_159064094.1"
      },
      "complete": "MSNSVHNTDRRTAMENMEPETSYEVPELVELGDYDDLTRGVGFPLADFFIHFD",
      "leader": [
        "MSNSVHNTDRRTAMENMEPETSYEVPELVELGDYDDLTR"
      ],
      "core": [
        "GVGFPLADFFIHFD"
      ]
    }
  ]
}
