{
  "identifiers": {
    "ncbi_acc": "GL636070.1",
    "mibig_acc": "BGC0003095"
  },
  "compound_name": [
    "LANII-715"
  ],
  "ripp_class": "Lanthipeptide",
  "ref": [
    "doi:10.1038/s41564-023-01524-6"
  ],
  "entries": [
    {
      "protein_ids": {
        "genpept": "HGD3082990.1"
      },
      "complete": "MNNEDFNLDLVTISKENNSGASTRVTSKSLCTPGCKTGILMTCAIKTATCGCHFG",
      "leader": [
        "MNNEDFNLDLVTISKENNSGASTR"
      ],
      "core": [
        "VTSKSLCTPGCKTGILMTCAIKTATCGCHFG"
      ]
    }
  ]
}
