{
  "identifiers": {
    "ncbi_acc": "AY007251.1",
    "mibig_acc": "BGC0000623"
  },
  "compound_name": [
    "plantaricin W a",
    "plantaricin W b"
  ],
  "ripp_class": "TBA",
  "ref": [
    "doi:10.1099/00221287-147-3-643"
  ],
  "entries": [
    {
      "protein_ids": {
        "genpept": "AAG02566.1",
        "uniprot": "Q9AF68"
      },
      "complete": "MTKTSRRKNAIANYLEPVDEKSINESFGAGDPEARSGIPCTIGAAVAASIAVCPTTKCSKRCGKRKK",
      "leader": [
        "MTKTSRRKNAIANYLEPVDEKSINESFGAGDPEAR"
      ],
      "core": [
        "SGIPCTIGAAVAASIAVCPTTKCSKRCGKRKK"
      ]
    },
    {
      "protein_ids": {
        "genpept": "AAG02567.1",
        "uniprot": "D2KR94"
      },
      "complete": "MKISKIEAQARKDFFKKIDTNSNLLNVNGAKCKWWNISCDLGNNGHVCTLSHECQVSCN",
      "leader": [
        "MKISKIEAQARKDFFKKIDTNSNLLNVNGA"
      ],
      "core": [
        "KCKWWNISCDLGNNGHVCTLSHECQVSCN"
      ]
    }
  ]
}
