{
  "identifiers": {
    "ncbi_acc": "CP006259.1",
    "mibig_acc": "BGC0001226"
  },
  "compound_name": [
    "streptocollin"
  ],
  "ripp_class": "Lanthipeptide",
  "ref": [
    "doi:10.1002/cbic.201500377"
  ],
  "entries": [
    {
      "protein_ids": {
        "genpept": "ALA50776.1",
        "uniprot": "A0A0R8Y1S5"
      },
      "complete": "MENQTLELLAHLHALPETDPVDFDGASYSGTCACVGLLTLLNTVCVGISCA",
      "leader": [
        "MENQTLELLAHLHALPETDPVDFDGASY"
      ],
      "core": [
        "SGTCACVGLLTLLNTVCVGISCA"
      ]
    }
  ]
}
