{
      "identifiers": {
            "ncbi_acc": "AF063590.3",
            "mibig_acc": "BGC0000586"
      },
      "compound_name": [
            "microcin E492"
      ],
      "ripp_class": "Microcin",
      "ref": [
            "doi:10.1128/jb.181.1.212-217.1999"
      ],
      "entries": [
            {
                  "protein_ids": {
                        "genpept": "AAD04332.2",
                        "uniprot": "Q9Z4N4"
                  },
                  "complete": "MREISQKDLNLAFGAGETDPNTQLLNDLGNNMAWGAALGAPGGLGSAALGAAGGALQTVGQGLIDHGPVNVPIPVLIGPSWNGSGSGYNSATSSSGSGS",
                  "leader": [
                        "MREISQKDLNLAFGA"
                  ],
                  "core": [
                        "GETDPNTQLLNDLGNNMAWGAALGAPGGLGSAALGAAGGALQTVGQGLIDHGPVNVPIPVLIGPSWNGSGSGYNSATSSSGSGS"
                  ],
                  "follower": [
                        ""
                  ]
            }
      ]
}