{
  "identifiers": {
    "ncbi_acc": "NZ_FOAZ01000001.1",
    "mibig_acc": "BGC0002972"
  },
  "compound_name": [
    "SjiA"
  ],
  "ripp_class": "other",
  "ref": [
    "doi:10.1002/anie.202107192"
  ],
  "entries": [
    {
      "protein_ids": {
        "genpept": "WP_369405959.1"
      },
      "complete": "MSASRDSKSRVTEVRSAVSSRPAPVRLAKRGDAAHSLMLSRVLPDNGVSRLDVAGFQSSI",
      "leader": [
        "TBA"
      ],
      "core": [
        "TBA"
      ],
      "follower": [
        "TBA"
      ]
    }
  ]
}
