{
  "identifiers": {
    "ncbi_acc": "OL539738.1",
    "mibig_acc": "BGC0002631"
  },
  "compound_name": [
    "Myxarylin"
  ],
  "ripp_class": "Cyptide",
  "ref": [
    "doi:10.3390/molecules26247483"
  ],
  "entries": [
    {
      "protein_ids": {
        "genpept": "UID85535.1"
      },
      "complete": "MNYLH",
      "leader": [
        "MN"
      ],
      "core": [
        "YLH"
      ]
    }
  ]
}
