{
      "identifiers": {
            "ncbi_acc": "EU290742.1",
            "mibig_acc": "BGC0000477"
      },
      "compound_name": [
            "patellin 2",
            "patellin 3"
      ],
      "ripp_class": "Cyanobactin",
      "ref": [
            "doi:10.1038/nchembio.84"
      ],
      "entries": [
            {
                  "protein_ids": {
                        "genpept": "ACA04491.1",
                        "uniprot": "B2KYG9"
                  },
                  "complete": "MNKKNILPQLGQPVIRLTAGQLSSQLAELSEEALGGVDASTLPVPTLCSYDGVDASTVPTLCSYDD",
                  "leader": [
                        "MNKKNILPQLGQPVIRLTAGQLSSQLAELSEEALGGVDAS"
                  ],
                  "core": [
                        "TLPVPTLC",
                        "TVPTLC"
                  ],
                  "follower": [
                        "SYDD"
                  ]
            }
      ]
}