{
  "identifiers": {
    "ncbi_acc": "FN178622.1",
    "mibig_acc": "BGC0000519"
  },
  "compound_name": [
    "labyrinthopeptin A2",
    "labyrinthopeptin A1",
    "labyrinthopeptin A3"
  ],
  "ripp_class": "Lanthipeptide",
  "ref": [
    "doi:10.1002/anie.200905909",
    "doi:10.1371/journal.pone.0064010"
  ],
  "entries": [
    {
      "protein_ids": {
        "genpept": "CAX48972.1",
        "uniprot": "C0MP59"
      },
      "complete": "MASILELQDLEVERASSAADSNASVWECCSTGSWVPFTCC",
      "leader": [
        "MASILELQDLEVERASSAAD"
      ],
      "core": [
        "SNASVWECCSTGSWVPFTCC"
      ]
    },
    {
      "protein_ids": {
        "genpept": "CAX48973.1",
        "uniprot": "C0MP60"
      },
      "complete": "MASILELQNLDVEHARGENRSDWSLWECCSTGSLFACC",
      "leader": [
        "MASILELQNLDVEHARGENR"
      ],
      "core": [
        "SDWSLWECCSTGSLFACC"
      ]
    }
  ]
}
