{
  "identifiers": {
    "ncbi_acc": "L37110.1",
    "mibig_acc": "BGC0000504"
  },
  "compound_name": [
    "cytolysin ClyLl",
    "cytolysin ClyLs"
  ],
  "ripp_class": "Lanthipeptide",
  "ref": [
    "doi:10.3390/toxins5050895"
  ],
  "entries": [
    {
      "protein_ids": {
        "genpept": "AAA62648.1",
        "uniprot": "Q52052"
      },
      "complete": "MENLSVVPSFEELSVEEMEAIQGSGDVQAETTPVCAVAATAAASSAACGWVGGGIFTGVTVVVSLKHC",
      "leader": [
        "MENLSVVPSFEELSVEEMEAIQGSGDVQAE"
      ],
      "core": [
        "TTPVCAVAATAAASSAACGWVGGGIFTGVTVVVSLKHC"
      ]
    },
    {
      "protein_ids": {
        "genpept": "AAA62649.1",
        "uniprot": "Q52053"
      },
      "complete": "MLNKENQENYYSNKLELVGPSFEELSLEEMEAIQGSGDVQAETTPACFTIGLGVGALFSAKFC",
      "leader": [
        "MLNKENQENYYSNKLELVGPSFEELSLEEMEAIQGSGDVQAE"
      ],
      "core": [
        "TTPACFTIGLGVGALFSAKFC"
      ]
    }
  ]
}
