{
  "identifiers": {
    "ncbi_acc": "NZ_GG657756.1",
    "mibig_acc": "BGC0000596"
  },
  "compound_name": [
    "SLI-2138"
  ],
  "ripp_class": "N-Formylated TBA",
  "ref": [
    "doi:10.1038/nchembio.684"
  ],
  "entries": [
    {
      "protein_ids": {
        "genpept": "WP_016326148.1"
      },
      "complete": "MQTVVDAHVPSSPGGARRVPHLNSARSCTIMNLLTDILAGLVHFVGWLV",
      "leader": [
        "MQTVVDAHVPSSPGGARRVPHLNSARSCTI"
      ],
      "core": [
        "MNLLTDILAGLVHFVGWLV"
      ]
    }
  ]
}
