{
      "identifiers": {
            "ncbi_acc": "ML179655.1",
            "mibig_acc": "BGC0002746"
      },
      "compound_name": [
            "dendrothelin A"
      ],
      "ripp_class": "Borosin",
      "ref": [
            "doi:10.1038/s41598-021-83106-2"
      ],
      "entries": [
            {
                  "protein_ids": {
                        "genpept": "THU83553.1",
                        "uniprot": "A0A4S8L5C5"
                  },
                  "complete": "MESSTQTKPGSLIVVGTGIESIGQMTLQALSYIEAASKVFYCVIDPATEAFILTKNKNCVDLYQYYDNGKSRMDTYTQMAELMLKEVRNGLDVVGVFYGHPGVFVNPSHRALAIARSEGYQARMLPGVSAEDCLFADLCIDPSNPGCLTYEASDFLIRERPVNVHSHLILFQVGCVGIADFNFSGFDNSKFTILVDRLEQEYGPDHTVVHYIAAMMPHQDPVTDKFTIGQLREPEIAKRVGGVSTFYIPPKARKDINTDIIRLLEFLPAGKVPDKHTQIYPPNQWEPDVPTLPPYGQNEQAAITRLEAHAPPEEYQPLATSKAMTDVMTKLALDPKALAEYKADHRAFAQSVPDLTPQERAALELGDSWAIRCAMKNMPSSLLEAASQSVEEASMNGFPWVIVTGIVGVIGSVVSSA",
                  "leader": [
                        "MESSTQTKPGSLIVVGTGIESIGQMTLQALSYIEAASKVFYCVIDPATEAFILTKNKNCVDLYQYYDNGKSRMDTYTQMAELMLKEVRNGLDVVGVFYGHPGVFVNPSHRALAIARSEGYQARMLPGVSAEDCLFADLCIDPSNPGCLTYEASDFLIRERPVNVHSHLILFQVGCVGIADFNFSGFDNSKFTILVDRLEQEYGPDHTVVHYIAAMMPHQDPVTDKFTIGQLREPEIAKRVGGVSTFYIPPKARKDINTDIIRLLEFLPAGKVPDKHTQIYPPNQWEPDVPTLPPYGQNEQAAITRLEAHAPPEEYQPLATSKAMTDVMTKLALDPKALAEYKADHRAFAQSVPDLTPQERAALELGDSWAIRCAMKNMPSSLLEAASQSVEEASMNGFP"
                  ],
                  "core": [
                        "WVIVTGIVGVIGSVVSSA"
                  ],
                  "follower": [
                        ""
                  ]
            }
      ]
}